{
  "$schema": "https://example.invalid/ai-migration-framework/schemas/fixture.schema.json",
  "schema_version": "2.0",
  "id": "cpp-service-cmake",
  "source_profile": "cpp",
  "target_profile": "java-25",
  "output_profile": "service",
  "build_system": "cmake",
  "test_framework": "googletest",
  "source_units": ["pricing-api", "quote-engine", "native-market-feed", "service-tests"],
  "hazards": ["raii-ownership", "shared-mutex-concurrency", "floating-point-rounding", "native-abi", "platform-conditionals"],
  "interfaces": ["http", "filesystem", "native-library", "clock"],
  "acceptance": ["characterization-before-translation", "modular-hexagonal-boundaries", "differential-pricing-tests", "slice-rollback-route"]
}
