{
  "$schema": "https://example.invalid/ai-migration-framework/schemas/fixture.schema.json",
  "schema_version": "2.0",
  "id": "cpp-sdk-cmake",
  "source_profile": "cpp",
  "target_profile": "java-25",
  "output_profile": "sdk",
  "build_system": "cmake",
  "test_framework": "doctest",
  "source_units": ["versioned-public-api", "client-core", "serialization", "examples", "sdk-tests"],
  "hazards": ["binary-compatibility", "serialization-layout", "default-arguments", "ownership-transfer", "deprecated-api"],
  "interfaces": ["consumer-api", "network", "examples", "documentation"],
  "acceptance": ["api-compatibility-report", "documented-public-api", "compiled-examples", "consumer-contract-tests"]
}
