{
  "$schema": "https://example.invalid/ai-migration-framework/schemas/fixture.schema.json",
  "schema_version": "2.0",
  "id": "golden-multimodule",
  "source_profile": "cpp",
  "target_profile": "java-25",
  "output_profile": "service",
  "build_system": "cmake",
  "test_framework": "catch2",
  "source_units": ["catalog-core", "ordering-core", "storage-adapter", "legacy-http", "golden-tests"],
  "hazards": ["raii-transaction", "thread-pool-ordering", "macro-feature-flag", "intentional-divergence", "native-sqlite"],
  "interfaces": ["http", "database", "clock", "filesystem", "legacy-routing-seam"],
  "acceptance": ["two-independent-slices", "blocked-and-resumed-state", "intentional-divergence-record", "failure-recovery-evidence", "cutover-and-decommission-plan"]
}
